<?xml version="1.0" standalone="no"?>
<!DOCTYPE crossway-crossrefs SYSTEM "schema/crossway.crossrefs.dtd">
<crossway-crossrefs translation="English Standard Version" edition="Text Only" match="//crossref[(starts-with(@cid, 't')]" revision="2025-02-02">
<book num="40">
	<chapter id="40001">
		<verse id="40001023">
			<letter id="40001023.1">
				<text>Isa. 7:14</text>
				<cids><cid>t40001023.1</cid></cids>
				<refs>
					<ref for="23007014">Isa. 7:14</ref>
				</refs>
			</letter>
		</verse>
	</chapter>
	<chapter id="40002">
		<verse id="40002006">
			<letter id="40002006.1">
				<text>Mic. 5:2</text>
				<cids><cid>t40002006.1</cid></cids>
				<refs>
					<ref for="33005002">Mic. 5:2</ref>
				</refs>
			</letter>
		</verse>
		<verse id="40002015">
			<letter id="40002015.1">
				<text>Hos. 11:1</text>
				<cids><cid>t40002015.1</cid></cids>
				<refs>
					<ref for="28011001">Hos. 11:1</ref>
				</refs>
			</letter>
		</verse>
		<verse id="40002018">
			<letter id="40002018.1">
				<text>Jer. 31:15</text>
				<cids><cid>t40002018.1</cid></cids>
				<refs>
					<ref for="24031015">Jer. 31:15</ref>
				</refs>
			</letter>
		</verse>
	</chapter>
	<chapter id="40003">
		<verse id="40003001">
			<letter id="40003001.1">
				<text>For 3:1-12 see parallels Mark 1:2-8; Luke 3:1-17</text>
				<cids><cid>t40003001.1</cid></cids>
				<refs>
					<meta class="for">For </meta>
					<ref for="40003001-40003012">3:1-12</ref>
					<meta class="see-parallels"> see parallels </meta>
					<ref for="41001002-41001008">Mark 1:2-8</ref>
					<meta class="separator">; </meta>
					<ref for="42003001-42003017">Luke 3:1-17</ref>
				</refs>
			</letter>
		</verse>
		<verse id="40003003">
			<letter id="40003003.1">
				<text>Isa. 40:3</text>
				<cids><cid>t40003003.1</cid></cids>
				<refs>
					<ref for="23040003">Isa. 40:3</ref>
				</refs>
			</letter>
		</verse>
		<verse id="40003013">
			<letter id="40003013.1">
				<text>For 3:13-17 see parallels Mark 1:9-11; Luke 3:21, 22</text>
				<cids><cid>t40003013.1</cid></cids>
				<refs>
					<meta class="for">For </meta>
					<ref for="40003013-40003017">3:13-17</ref>
					<meta class="see-parallels"> see parallels </meta>
					<ref for="41001009-41001011">Mark 1:9-11</ref>
					<meta class="separator">; </meta>
					<ref for="42003021-42003022">Luke 3:21<meta class="separator-weak">, </meta>22</ref>
				</refs>
			</letter>
		</verse>
	</chapter>
	<chapter id="40004">
		<verse id="40004001">
			<letter id="40004001.1">
				<text>For 4:1-11 see parallels Mark 1:12, 13; Luke 4:1-13</text>
				<cids><cid>t40004001.1</cid></cids>
				<refs>
					<meta class="for">For </meta>
					<ref for="40004001-40004011">4:1-11</ref>
					<meta class="see-parallels"> see parallels </meta>
					<ref for="41001012-41001013">Mark 1:12<meta class="separator-weak">, </meta>13</ref>
					<meta class="separator">; </meta>
					<ref for="42004001-42004013">Luke 4:1-13</ref>
				</refs>
			</letter>
		</verse>
		<verse id="40004004">
			<letter id="40004004.1">
				<text>Deut. 8:3</text>
				<cids><cid>t40004004.1</cid></cids>
				<refs>
					<ref for="05008003">Deut. 8:3</ref>
				</refs>
			</letter>
		</verse>
		<verse id="40004006">
			<letter id="40004006.1">
				<text>Ps. 91:11, 12</text>
				<cids><cid>t40004006.1</cid></cids>
				<refs>
					<ref for="19091011-19091012">Ps. 91:11<meta class="separator-weak">, </meta>12</ref>
				</refs>
			</letter>
		</verse>
		<verse id="40004007">
			<letter id="40004007.1">
				<text>Deut. 6:16</text>
				<cids><cid>t40004007.1</cid></cids>
				<refs>
					<ref for="05006016">Deut. 6:16</ref>
				</refs>
			</letter>
		</verse>
		<verse id="40004010">
			<letter id="40004010.1">
				<text>Deut. 6:13</text>
				<cids><cid>t40004010.1</cid></cids>
				<refs>
					<ref for="05006013">Deut. 6:13</ref>
				</refs>
			</letter>
		</verse>
		<verse id="40004015">
			<letter id="40004015.1">
				<text>Isa. 9:1, 2</text>
				<cids><cid>t40004015.1</cid></cids>
				<refs>
					<ref for="23009001-23009002">Isa. 9:1<meta class="separator-weak">, </meta>2</ref>
				</refs>
			</letter>
		</verse>
		<verse id="40004018">
			<letter id="40004018.1">
				<text>For 4:18-22 see parallel Mark 1:16-20</text>
				<cids><cid>t40004018.1</cid></cids>
				<refs>
					<meta class="for">For </meta>
					<ref for="40004018-40004022">4:18-22</ref>
					<meta class="see-parallel"> see parallel </meta>
					<ref for="41001016-41001020">Mark 1:16-20</ref>
				</refs>
			</letter>
		</verse>
	</chapter>
	<chapter id="40005">
		<verse id="40005021">
			<letter id="40005021.1">
				<text>Ex. 20:13; Deut. 5:17</text>
				<cids><cid>t40005021.1</cid></cids>
				<refs>
					<ref for="02020013">Ex. 20:13</ref>
					<meta class="separator">; </meta>
					<ref for="05005017">Deut. 5:17</ref>
				</refs>
			</letter>
		</verse>
		<verse id="40005027">
			<letter id="40005027.1">
				<text>Ex. 20:14; Deut. 5:18</text>
				<cids><cid>t40005027.1</cid></cids>
				<refs>
					<ref for="02020014">Ex. 20:14</ref>
					<meta class="separator">; </meta>
					<ref for="05005018">Deut. 5:18</ref>
				</refs>
			</letter>
		</verse>
		<verse id="40005031">
			<letter id="40005031.1">
				<text>Deut. 24:1</text>
				<cids><cid>t40005031.1</cid></cids>
				<refs>
					<ref for="05024001">Deut. 24:1</ref>
				</refs>
			</letter>
		</verse>
		<verse id="40005038">
			<letter id="40005038.1">
				<text>Ex. 21:24; Lev. 24:20; Deut. 19:21</text>
				<cids><cid>t40005038.1</cid></cids>
				<refs>
					<ref for="02021024">Ex. 21:24</ref>
					<meta class="separator">; </meta>
					<ref for="03024020">Lev. 24:20</ref>
					<meta class="separator">; </meta>
					<ref for="05019021">Deut. 19:21</ref>
				</refs>
			</letter>
		</verse>
		<verse id="40005039">
			<letter id="40005039.1">
				<text>For 5:39-42 see parallel Luke 6:29, 30</text>
				<cids><cid>t40005039.1</cid></cids>
				<refs>
					<meta class="for">For </meta>
					<ref for="40005039-40005042">5:39-42</ref>
					<meta class="see-parallel"> see parallel </meta>
					<ref for="42006029-42006030">Luke 6:29<meta class="separator-weak">, </meta>30</ref>
				</refs>
			</letter>
		</verse>
		<verse id="40005043">
			<letter id="40005043.1">
				<text>Lev. 19:18</text>
				<cids><cid>t40005043.1</cid></cids>
				<refs>
					<ref for="03019018">Lev. 19:18</ref>
				</refs>
			</letter>
		</verse>
	</chapter>
	<chapter id="40006">
		<verse id="40006025">
			<letter id="40006025.1">
				<text>For 6:25-33 see parallel Luke 12:22-31</text>
				<cids><cid>t40006025.1</cid></cids>
				<refs>
					<meta class="for">For </meta>
					<ref for="40006025-40006033">6:25-33</ref>
					<meta class="see-parallel"> see parallel </meta>
					<ref for="42012022-42012031">Luke 12:22-31</ref>
				</refs>
			</letter>
		</verse>
	</chapter>
	<chapter id="40007">
		<verse id="40007001">
			<letter id="40007001.1">
				<text>For 7:1-5 see parallel Luke 6:37, 38, 41, 42</text>
				<cids><cid>t40007001.1</cid></cids>
				<refs>
					<meta class="for">For </meta>
					<ref for="40007001-40007005">7:1-5</ref>
					<meta class="see-parallel"> see parallel </meta>
					<ref for="42006037-42006038">Luke 6:37<meta class="separator-weak">, </meta>38</ref>
					<meta class="separator-weak">, </meta>
					<ref for="42006041-42006042">41<meta class="separator-weak">, </meta>42</ref>
				</refs>
			</letter>
		</verse>
		<verse id="40007007">
			<letter id="40007007.1">
				<text>For 7:7-11 see parallel Luke 11:9-13</text>
				<cids><cid>t40007007.1</cid></cids>
				<refs>
					<meta class="for">For </meta>
					<ref for="40007007-40007011">7:7-11</ref>
					<meta class="see-parallel"> see parallel </meta>
					<ref for="42011009-42011013">Luke 11:9-13</ref>
				</refs>
			</letter>
		</verse>
		<verse id="40007024">
			<letter id="40007024.1">
				<text>For 7:24-27 see parallel Luke 6:47-49</text>
				<cids><cid>t40007024.1</cid></cids>
				<refs>
					<meta class="for">For </meta>
					<ref for="40007024-40007027">7:24-27</ref>
					<meta class="see-parallel"> see parallel </meta>
					<ref for="42006047-42006049">Luke 6:47-49</ref>
				</refs>
			</letter>
		</verse>
	</chapter>
	<chapter id="40008">
		<verse id="40008002">
			<letter id="40008002.1">
				<text>For 8:2-4 see parallels Mark 1:40-44; Luke 5:12-14</text>
				<cids><cid>t40008002.1</cid></cids>
				<refs>
					<meta class="for">For </meta>
					<ref for="40008002-40008004">8:2-4</ref>
					<meta class="see-parallels"> see parallels </meta>
					<ref for="41001040-41001044">Mark 1:40-44</ref>
					<meta class="separator">; </meta>
					<ref for="42005012-42005014">Luke 5:12-14</ref>
				</refs>
			</letter>
		</verse>
		<verse id="40008005">
			<letter id="40008005.1">
				<text>For 8:5-13 see parallel Luke 7:1-10</text>
				<cids><cid>t40008005.1</cid></cids>
				<refs>
					<meta class="for">For </meta>
					<ref for="40008005-40008013">8:5-13</ref>
					<meta class="see-parallel"> see parallel </meta>
					<ref for="42007001-42007010">Luke 7:1-10</ref>
				</refs>
			</letter>
		</verse>
		<verse id="40008014">
			<letter id="40008014.1">
				<text>For 8:14-17 see parallels Mark 1:29-34; Luke 4:38-41</text>
				<cids><cid>t40008014.1</cid></cids>
				<refs>
					<meta class="for">For </meta>
					<ref for="40008014-40008017">8:14-17</ref>
					<meta class="see-parallels"> see parallels </meta>
					<ref for="41001029-41001034">Mark 1:29-34</ref>
					<meta class="separator">; </meta>
					<ref for="42004038-42004041">Luke 4:38-41</ref>
				</refs>
			</letter>
		</verse>
		<verse id="40008017">
			<letter id="40008017.1">
				<text>Isa. 53:4</text>
				<cids><cid>t40008017.1</cid></cids>
				<refs>
					<ref for="23053004">Isa. 53:4</ref>
				</refs>
			</letter>
		</verse>
		<verse id="40008019">
			<letter id="40008019.1">
				<text>For 8:19-22 see parallel Luke 9:57-62</text>
				<cids><cid>t40008019.1</cid></cids>
				<refs>
					<meta class="for">For </meta>
					<ref for="40008019-40008022">8:19-22</ref>